{"aud":"furatena.preview","exp":1893456390,"head_sha":"aaaaaaaaaaaaaaaaaaaaaaaaaaaaaaaaaaaaaaaa","iat":1893456090,"iss":"https://auth.furatena.example/preview","jti":"grant_jti_12345678901234567890","kid":"preview-key-2030-01","nbf":1893456090,"nonce":"bbbbbbbbbbbbbbbbbbbbbbbbbbbbbbbbbbbbbbbbbbb","origin":"https://pr-518.preview.example","pull_request_number":518,"repository_id":"repository-4242","scope":["preview:read"],"sub":"reviewer:stable-pseudonym","ver":1}
